[
  {
    "id": "NIAH-50010320",
    "name": "O'Connell Monument",
    "publisher": "Department of Housing, Local Government and Heritage",
    "url": "https://www.buildingsofireland.ie/buildings-search/building/50010320/oconnell-monument-dublin-city",
    "accessed": "2026-10-24"
  },
  {
    "id": "NIAH-50010528",
    "name": "General Post Office",
    "publisher": "Department of Housing, Local Government and Heritage",
    "url": "https://www.buildingsofireland.ie/buildings-search/building/50010528/general-post-office-oconnell-street-lower-dublin-1-dublin",
    "accessed": "2026-10-24"
  },
  {
    "id": "NIAH-50010527",
    "name": "GPO lantern bases and wheel guards",
    "publisher": "Department of Housing, Local Government and Heritage",
    "url": "https://www.buildingsofireland.ie/buildings-search/building/50010527/general-post-office-gpo-oconnell-street-lower-dublin-1-dublin",
    "accessed": "2026-10-24"
  },
  {
    "id": "NIAH-50010002",
    "name": "Famine Memorial",
    "publisher": "Department of Housing, Local Government and Heritage",
    "url": "https://www.buildingsofireland.ie/buildings-search/building/50010002/famine-custom-house-quay-dublin-1-dublin",
    "accessed": "2026-10-24"
  },
  {
    "id": "NIAH-50010133",
    "name": "The Custom House",
    "publisher": "Department of Housing, Local Government and Heritage",
    "url": "https://www.buildingsofireland.ie/buildings-search/building/50010133/custom-house-custom-house-quay-beresford-place-dublin-1-co-dublin",
    "accessed": "2026-10-24"
  },
  {
    "id": "NIAH-50020253",
    "name": "Henry Grattan Monument",
    "publisher": "Department of Housing, Local Government and Heritage",
    "url": "https://www.buildingsofireland.ie/buildings-search/building/50020253/henry-grattan-monument-college-green-dublin-2-dublin",
    "accessed": "2026-10-24"
  },
  {
    "id": "NIAH-50020252",
    "name": "Thomas Davis Monument",
    "publisher": "Department of Housing, Local Government and Heritage",
    "url": "https://www.buildingsofireland.ie/buildings-search/building/50020252/thomas-davis-monument-college-green-dublin-2-dublin",
    "accessed": "2026-10-24"
  },
  {
    "id": "NIAH-50020521",
    "name": "George Salmon Statue",
    "publisher": "Department of Housing, Local Government and Heritage",
    "url": "https://www.buildingsofireland.ie/buildings-search/building/50020521/george-salmon-statue-trinity-college-dublin-2-dublin",
    "accessed": "2026-10-24"
  },
  {
    "id": "NIAH-50020520",
    "name": "Lecky Statue",
    "publisher": "Department of Housing, Local Government and Heritage",
    "url": "https://www.buildingsofireland.ie/buildings-search/building/50020520/lecky-statue-trinity-college-dublin-2-dublin",
    "accessed": "2026-10-24"
  },
  {
    "id": "NIAH-50020374",
    "name": "Edmund Burke Statue",
    "publisher": "Department of Housing, Local Government and Heritage",
    "url": "https://www.buildingsofireland.ie/buildings-search/building/50020374/edmund-burke-statue-dublin-city",
    "accessed": "2026-10-24"
  },
  {
    "id": "NIAH-50020518",
    "name": "Cactus Provisoire",
    "publisher": "Department of Housing, Local Government and Heritage",
    "url": "https://www.buildingsofireland.ie/buildings-search/building/50020518/cactus-provisoire-trinity-college-dublin-2-dublin",
    "accessed": "2026-10-24"
  },
  {
    "id": "NIAH-50020517",
    "name": "Reclining Figures",
    "publisher": "Department of Housing, Local Government and Heritage",
    "url": "https://www.buildingsofireland.ie/buildings-search/building/50020517/reclining-figures-trinity-college-dublin-2-dublin",
    "accessed": "2026-10-24"
  },
  {
    "id": "NIAH-50910009",
    "name": "City Hall",
    "publisher": "Department of Housing, Local Government and Heritage",
    "url": "https://www.buildingsofireland.ie/buildings-search/building/50910009/city-hall-cork-hill-exchange-court-dublin-2-dublin",
    "accessed": "2026-10-24"
  },
  {
    "id": "NIAH-50910280",
    "name": "Old Detective Office",
    "publisher": "Department of Housing, Local Government and Heritage",
    "url": "https://www.buildingsofireland.ie/buildings-search/building/50910280/old-detective-office-1-exchange-court-dublin-2-dublin",
    "accessed": "2026-10-24"
  },
  {
    "id": "NIAH-GPO-HISTORY",
    "name": "GPO — Building of the Month",
    "publisher": "Department of Housing, Local Government and Heritage",
    "url": "https://www.buildingsofireland.ie/building-of-the-month/the-general-post-office-oconnell-street-dublin-1/",
    "accessed": "2026-10-24"
  },
  {
    "id": "SRC-DUB-LOCAL-AUTH-001",
    "name": "The four Dublin council areas",
    "publisher": "Dublin.ie",
    "url": "https://dublin.ie/live/life-in-dublin/dublin-council-areas/",
    "accessed": "2026-10-24",
    "source_type": "GOVERNMENT",
    "notes": "Identifies Dublin City Council, Fingal County Council, South Dublin County Council and Dún Laoghaire-Rathdown County Council as the four local authorities serving County Dublin."
  },
  {
    "id": "SRC-DUB-TOWNLANDS-2026",
    "name": "Townlands — National Statutory Boundaries — Ungeneralised 2026",
    "publisher": "Tailte Éireann via data.gov.ie",
    "url": "https://data.gov.ie/dataset/townlands-national-statutory-boundaries-ungeneralised-20261",
    "accessed": "2026-10-24",
    "source_type": "OFFICIAL_REGISTER",
    "specific_reference": "2026 national statutory boundary dataset; townlands layer; Tailte Éireann",
    "notes": "Official townland boundary dataset. Confirm reuse licence and attribution conditions before redistributing extracted geometry."
  },
  {
    "id": "SRC-DUB-BOUNDARY-OPEN-DATA",
    "name": "Tailte Éireann Boundary Data",
    "publisher": "Tailte Éireann",
    "url": "https://tailte.ie/map-shop/professional-map-products/boundary-data/",
    "accessed": "2026-10-24",
    "source_type": "GOVERNMENT",
    "notes": "Describes administrative and statutory boundary products, including counties, local authority areas, townlands and electoral divisions, and cautions that legal boundary delineation must be checked against the relevant Ordnance Map."
  },
  {
    "id": "NIAH-50010519",
    "name": "Jim Larkin Monument, O'Connell Street Lower",
    "publisher": "Department of Housing, Local Government and Heritage",
    "url": "https://www.buildingsofireland.ie/buildings-search/building/50010519/jim-larkin-monument-oconnell-street-lower-dublin-1-dublin",
    "accessed": "2026-10-24",
    "source_type": "OFFICIAL_REGISTER",
    "specific_reference": "NIAH Registration No. 50010519",
    "notes": "NIAH record describes the 1980 bronze monument by Oisín Kelly, granite pedestal and three inset bronze inscription plaques; ITM/Irish grid coordinates recorded by NIAH as 315925, 234593."
  },
  {
    "id": "NIAH-50010137",
    "name": "Talbot Street Post Box",
    "publisher": "Department of Housing, Local Government and Heritage",
    "url": "https://www.buildingsofireland.ie/buildings-search/building/50010137/talbot-street-dublin-1-dublin",
    "accessed": "2026-10-24",
    "source_type": "OFFICIAL_REGISTER",
    "specific_reference": "NIAH Registration No. 50010137",
    "notes": "NIAH records a c.1935 freestanding cast-iron P&T post box with Carron Company maker's mark; coordinates 316517, 234862."
  },
  {
    "id": "NIAH-50010760",
    "name": "Gardiner Street Upper Post Box",
    "publisher": "Department of Housing, Local Government and Heritage",
    "url": "https://www.buildingsofireland.ie/buildings-search/building/50010760/gardiner-street-upper-dublin-1-dublin",
    "accessed": "2026-10-24",
    "source_type": "OFFICIAL_REGISTER",
    "specific_reference": "NIAH Registration No. 50010760",
    "notes": "NIAH records a c.1880 Victorian cast-iron pillar box bearing VR insignia and A. Handyside & Co. maker's inscription; coordinates 315856, 235627."
  },
  {
    "id": "NIAH-50010206",
    "name": "10 Talbot Street",
    "publisher": "Department of Housing, Local Government and Heritage",
    "url": "https://www.buildingsofireland.ie/buildings-search/building/50010206/talbot-street-dublin-1-dublin",
    "accessed": "2026-10-24",
    "source_type": "OFFICIAL_REGISTER",
    "specific_reference": "NIAH Registration No. 50010206",
    "notes": "NIAH records a c.1840 terraced house with surviving Victorian upper-floor fabric, Flemish-bond brickwork, granite sills and decorative brick eaves course; coordinates 316154, 234766."
  },
  {
    "id": "SRC-DCC-BHA18",
    "name": "Dublin City Development Plan 2022–2028 — Policy BHA18",
    "publisher": "Dublin City Council",
    "url": "https://www.dublincity.ie/dublin-city-development-plan-2022-2028/written-statement/chapter-11-built-heritage-and-archaeology/115-policies-and-objectives",
    "accessed": "2026-10-24",
    "source_type": "GOVERNMENT",
    "specific_reference": "Section 11.5; Policy BHA18 — Historic Ground Surfaces, Street Furniture and Public Realm",
    "notes": "Council policy identifies historic ground surfaces and public-realm features including milestones, jostle stones, ward stones, bollards, coal-hole covers, gratings, boot scrapers, cast-iron basement lights, street skylights, water troughs, post boxes, lampposts and railings."
  },
  {
    "id": "SRC-NIAH-NORTH-CITY",
    "name": "Architectural Inventory of Dublin North City",
    "publisher": "National Inventory of Architectural Heritage, Department of Housing, Local Government and Heritage",
    "url": "https://www.buildingsofireland.ie/app/uploads/2019/10/Dublin-North-City.pdf",
    "accessed": "2026-10-24",
    "source_type": "OFFICIAL_REGISTER",
    "specific_reference": "Introduction and scope of the Dublin North City architectural inventory",